{
  "schema_version": "1.0.0",
  "event_id": "22222222-2222-4222-8222-222222222222",
  "request_id": "11111111-1111-4111-8111-111111111111",
  "run_id": "33333333-3333-4333-8333-333333333333",
  "compute_location": "local",
  "sequence": 12,
  "timestamp": "2026-10-04T12:00:00Z",
  "stage": "pose2d",
  "status": "progress",
  "message": "Processed frame 360 of 727",
  "progress": {
    "completed": 360,
    "total": 727,
    "unit": "frames"
  }
}
